{
  "tenant": "tenant-a",
  "transition": "EnterReadOnly",
  "occurredAt": "2026-08-15T10:00:00Z",
  "timeline": {
    "trialStartedAt": "2026-08-01T10:00:00Z",
    "trialExpiresAt": "2026-08-15T10:00:00Z",
    "readOnlyUntil": null,
    "lockedAt": null,
    "retentionUntil": null,
    "purgedAt": null
  },
  "phaseUntil": "2026-08-22T10:00:00Z"
}
